rank,peak,artist,title,last_week,weeks_on_chart,no_1_weeks_no_1,no_1_last_week,no_1_last_week_weeks_at_one,no_1_weeks_on_chart
1,1,BLACKstreet (Featuring Dr. Dre),No Diggity,NA,NA,4,NA,4 WEEKS AT NO. 1,8WEEKS ON CHART
2,2,Toni Braxton,Un-Break My Heart,3,6,NA,NA,NA,NA
3,2,Celine Dion,It's All Coming Back To Me Now,2,16,NA,NA,NA,NA
4,4,Merril Bainbridge, Mouth,4,13,NA,NA,NA,NA
5,5,Keith Sweat Featuring Athena Cage,Nobody,5,9,NA,NA,NA,NA
6,6,Ginuwine,Pony,6,13,NA,NA,NA,NA
7,7, En Vogue,Don't Let Go (Love),11,4,NA,NA,NA,NA
8,5,No Mercy,Where Do You Go,8,22,NA,NA,NA,NA
9,2,Donna Lewis,I Love You Always Forever,7,24,NA,NA,NA,NA
10,10,New Edition,I'm Still In Love With You,12,4,NA,NA,NA,NA
11,11,Barbra Streisand & Bryan Adams,"I Finally Found Someone (From ""The Mirror Has Two Faces"")",28,2,NA,NA,NA,NA
12,1,Los Del Rio,Macarena (Bayside Boys Mix),9,50,NA,NA,NA,NA
13,6,"Babyface Featuring LL Cool J, Howard Hewett, Jody Watley & Jeffrey Daniels",This Is For The Lover In You,10,6,NA,NA,NA,NA
14,11,Sheryl Crow,If It Makes You Happy,13,11,NA,NA,NA,NA
15,13, Journey,When You Love A Woman,14,6,NA,NA,NA,NA
16,9,Az Yet,"Last Night (From ""The Nutty Professor"")",15,15,NA,NA,NA,NA
17,17,Mint Condition,What Kind Of Man Would I Be,21,13,NA,NA,NA,NA
18,18,Madonna,"You Must Love Me (From ""Evita"")",18,3,NA,NA,NA,NA
19,19,Montell Jordan,Falling,19,9,NA,NA,NA,NA
20,2,Keith Sweat,Twisted,16,24,NA,NA,NA,NA
21,5,Eric Clapton,Change The World,17,20,NA,NA,NA,NA
22,18,Dru Hill,"Tell Me (From ""Eddie"")",22,14,NA,NA,NA,NA
23,1,Toni Braxton,You're Makin' Me High/Let It Flow,23,26,NA,NA,NA,NA
24,14,John Mellencamp,Key West Intermezzo (I Saw You First),20,14,NA,NA,NA,NA
25,25,Amber,This Is Your Night,25,25,NA,NA,NA,NA
26,15,Dishwalla ,Counting Blue Cars,26,35,NA,NA,NA,NA
27,3,Quad City DJ's,C'mon N' Ride It (The Train),24,38,NA,NA,NA,NA
28,28,Nas,Street Dreams,29,4,NA,NA,NA,NA
29,24,Bryan Adams,Let's Make A Night To Remember,27,14,NA,NA,NA,NA
30,30,dc Talk,Between You And Me,36,3,NA,NA,NA,NA
31,6,Alanis Morissette,You Learn/You Oughta Know,31,19,NA,NA,NA,NA
32,31,Ghost Town DJ's,My Boo,33,22,NA,NA,NA,NA
33,33,Nate Dogg Featuring Snoop Doggy Dogg,Never Leave Me Alone,39,4,NA,NA,NA,NA
34,30,Da Brat,Sittin' On Top Of The World,30,8,NA,NA,NA,NA
35,35,Lil' Kim Featuring Puff Daddy,No Time,42,4,NA,NA,NA,NA
36,3,LL Cool J,Loungin,35,22,NA,NA,NA,NA
37,21,Westside Connection,Bow Down,34,10,NA,NA,NA,NA
38,11,Aaliyah,If Your Girl Only Knew,32,14,NA,NA,NA,NA
39,3,Tracy Chapman,Give Me One Reason,38,35,NA,NA,NA,NA
40,22,Do Or Die (Featuring Twista),Po Pimp,37,18,NA,NA,NA,NA
41,41,702,Steelo,43,12,NA,NA,NA,NA
42,41,The Wonders,"That Thing You Do! (From ""That Thing You Do!"") ",41,8,NA,NA,NA,NA
43,43,The Braids,"Bohemian Rhapsody (From ""High School High"")",46,7,NA,NA,NA,NA
44,11,Jewel,Who Will Save Your Soul,40,27,NA,NA,NA,NA
45,9, Gin Blossoms,Follow You Down/Til I Hear It From You,48,43,NA,NA,NA,NA
46,25,"Brandy, Tamia, Gladys Knight & Chaka Khan","Missing You (From ""Set It Off"")",44,15,NA,NA,NA,NA
47,13,112 Featuring The Notorious B.I.G.,Only You,45,27,NA,NA,NA,NA
48,48,112,Come See Me,58,4,NA,NA,NA,NA
49,49,R.E.M.,Bittersweet Me,51,3,NA,NA,NA,NA
50,50,Total,When Boy Meets Girl,54,6,NA,NA,NA,NA
51,51,Jocelyn Enriquez,Do You Miss Me,52,19,NA,NA,NA,NA
52,52,The Cranberries,When You're Gone/Free To Decide,66,2,NA,NA,NA,NA
53,53,K-Ci & JoJo,"How Could You (From ""Bulletproof"")",53,3,NA,NA,NA,NA
54,54,Donell Jones,Knocks Me Off My Feet,59,5,NA,NA,NA,NA
55,45,Phil Collins,Dance Into The Light,55,6,NA,NA,NA,NA
56,47,The Isley Brothers Featuring Angela Winbush,Floatin' On Your Love,57,10,NA,NA,NA,NA
57,57,Rod Stewart,If We Fall In Love Tonight,65,3,NA,NA,NA,NA
58,40,Melissa Etheridge,Nowhere To Go,56,8,NA,NA,NA,NA
59,56,Republica,Ready To Go,60,17,NA,NA,NA,NA
60,54,Robert Miles Featuring Maria Nayler,One And One,61,9,NA,NA,NA,NA
61,NA,Jewel,Foolish Games/You Were Meant For Me,NA,NA,NA,NA,NA,NA
62,NA,OutKast,ATLiens,NA,NA,NA,NA,NA,NA
63,43,Amanda Marshall,Birmingham,62,10,NA,NA,NA,NA
64,64,Kenny G,The Moment,73,3,NA,NA,NA,NA
65,63,Wild Orchid,At Night I Pray,63,10,NA,NA,NA,NA
66,66,The Original,I Luv U Baby,71,7,NA,NA,NA,NA
67,NA,MC Lyte,Cold Rock A Party,NA,NA,NA,NA,NA,NA
68,22,SWV,Use Your Heart,64,16,NA,NA,NA,NA
69,69,Angelina,I Don't Need Your Love,75,7,NA,NA,NA,NA
70,36,Maxwell,Ascension (Don't Ever Wonder),68,16,NA,NA,NA,NA
71,NA, The Smashing Pumpkins,Thirty-Three,NA,NA,NA,NA,NA,NA
72,3,New Edition,Hit Me Off,70,14,NA,NA,NA,NA
73,73,Metallica,Hero Of The Day,74,4,NA,NA,NA,NA
74,74,Alan Jackson,Little Bitty,81,3,NA,NA,NA,NA
75,70,Elton John,You Can Make History (Young Again),77,6,NA,NA,NA,NA
76,76,Rockell,I Fell In Love,89,4,NA,NA,NA,NA
77,NA,Gina G,Ooh Aah... Just A Little Bit,NA,NA,NA,NA,NA,NA
78,51,Lost Boyz,Music Makes Me High,76,9,NA,NA,NA,NA
79,32,Warren G Featuring Adina Howard,"What's Love Got To Do With It (From ""Supercop"")",69,11,NA,NA,NA,NA
80,80,Le Click,Tonight Is The Night,80,13,NA,NA,NA,NA
81,24,Garbage,Stupid Girl,72,19,NA,NA,NA,NA
82,53,Johnny Gill,Let's Get The Mood Right,78,11,NA,NA,NA,NA
83,79,Crush,Jellyhead,92,16,NA,NA,NA,NA
84,40,T-Boz,"Touch Myself (From ""Fled"")",86,17,NA,NA,NA,NA
85,NA,Duncan Sheik,Barely Breathing,NA,NA,NA,NA,NA,NA
86,NA,Enigma,Beyond The Invisible,NA,NA,NA,NA,NA,NA
87,26,Whitney Houston,"Why Does It Hurt So Bad (From ""Waiting To Exhale"")",87,18,NA,NA,NA,NA
88,73,JAY-Z,Can't Knock The Hustle,88,12,NA,NA,NA,NA
89,65,Deana Carter,Strawberry Wine,79,9,NA,NA,NA,NA
90,85,Alfonzo Hunter,Just The Way (Playas Play),85,5,NA,NA,NA,NA
91,NA,Richie Rich ,Let's Ride,NA,NA,NA,NA,NA,NA
92,52, Luther Vandross,Your Secret Love,90,11,NA,NA,NA,NA
93,66,dog's eye view,Everything Falls Apart/Small Wonders,91,10,NA,NA,NA,NA
94,72,For Real,Like I Do,82,7,NA,NA,NA,NA
95,NA,Susanna Hoffs,All I Want,NA,NA,NA,NA,NA,NA
96,12,OutKast,Elevators (Me & You),83,19,NA,NA,NA,NA
97,97,Trace Adkins,Every Light In The House,97,2,NA,NA,NA,NA
98,84,Tina Turner,Missing You,96,9,NA,NA,NA,NA
99,94,Beck,Devil's Haircut,94,4,NA,NA,NA,NA
100,95,RuPaul,Snapshot,95,5,NA,NA,NA,NA
